{
  "slice_id": "slice-003",
  "verdict": "approved",
  "timestamp": "2026-04-12T18:00:00Z",
  "severity_summary": {
    "critical": 0,
    "high": 0,
    "medium": 0,
    "low": 0,
    "info": 0
  },
  "findings": [],
  "lgpd_checks": [
    {
      "check": "pii_in_logs",
      "status": "pass",
      "evidence": "Nenhum dado pessoal identificavel presente nos workflows, testes ou configuracoes do slice. Pipeline CI opera exclusivamente com metadados de codigo e dependencias."
    },
    {
      "check": "pii_in_artifacts",
      "status": "pass",
      "evidence": "SBOM contem inventario de dependencias de software (nomes de pacotes, versoes, hashes), sem dados de usuarios ou titulares de dados pessoais."
    },
    {
      "check": "pii_in_environment_variables",
      "status": "pass",
      "evidence": "Variaveis de ambiente do CI referem-se exclusivamente a credenciais de banco de dados de teste efemero no runner do GitHub Actions, sem dados pessoais de titulares."
    },
    {
      "check": "data_minimization",
      "status": "pass",
      "evidence": "Slice 003 nao processa, armazena ou transmite dados pessoais. Escopo restrito a pipeline de integracao continua."
    }
  ],
  "next_action": "approved"
}
