{
  "slice_id": "slice-010",
  "verdict": "approved",
  "timestamp": "2026-04-15T12:00:00Z",
  "severity_summary": {
    "critical": 0,
    "high": 0,
    "medium": 0,
    "low": 0,
    "info": 0
  },
  "findings": [],
  "lgpd_checks": [
    {
      "check": "base_legal_obrigatoria",
      "status": "pass",
      "evidence": "ConsentRecordService::guardTenantAndLgpd() bloqueia criação de consent_subject/consent_record se não existe LgpdCategory para o tenant (HTTP 422). LgpdCategoryService::declare() valida code e legal_basis contra enums LgpdCategory::CODES e LgpdCategory::LEGAL_BASES."
    },
    {
      "check": "consentimento_explicito_opt_in",
      "status": "pass",
      "evidence": "ConsentRecordService::handleOptIn() não grava se opted_in=false. Blade revoke-consent-page usa enum fixo (select) sem campo de texto livre. AC-003a coberto."
    },
    {
      "check": "pii_em_logs",
      "status": "pass",
      "evidence": "consent_records persiste apenas consent_subject_id (UUID opaco), channel, status, ip_address, user_agent_hash (SHA-256) e revocation_reason de enum fixo. Nenhum campo PII (name, email, cpf, whatsapp) na tabela de auditoria."
    },
    {
      "check": "direito_revogacao",
      "status": "pass",
      "evidence": "Rota pública /privacy/revoke/{token} sem autenticação. RevocationTokenService::processRevocationAttempt() lida com token válido, expirado e inexistente. Renovação automática de token expirado com envio de novo e-mail."
    },
    {
      "check": "token_revogacao_seguro",
      "status": "pass",
      "evidence": "RevocationTokenService::generate() usa random_bytes(32), persiste apenas SHA-256, retorna raw apenas para URL no e-mail. RevocationTokenService::findValidToken() usa hash_equals() para comparação constant-time (AC-SEC-004, AC-SEC-005)."
    },
    {
      "check": "append_only_audit_trail",
      "status": "pass",
      "evidence": "Migration 2026_04_15_000420 cria trigger consent_records_append_only_trigger (BEFORE UPDATE OR DELETE OR TRUNCATE). ConsentRecord::$timestamps=false evita UPDATE implícito via updated_at. AC-008 e AC-008a cobertos."
    },
    {
      "check": "isolamento_tenant",
      "status": "pass",
      "evidence": "Todos os models usam trait ScopesToCurrentTenant. Queries com withoutGlobalScopes() sempre filtradas por where('tenant_id', $tenant->id). LgpdCategoriesPage::deleteCategory() valida pertencimento antes de deletar."
    },
    {
      "check": "minimizacao_dados",
      "status": "pass",
      "evidence": "user_agent persistido apenas como SHA-256 hash. revocation_reason limitado a enum fixo (REVOCATION_REASONS) sem texto livre. strip_tags() em name, comment, retention_policy, email e phone antes de persistir."
    },
    {
      "check": "retencao_token",
      "status": "pass",
      "evidence": "RevocationToken.expires_at = granted_at + 30 dias. findValidToken() filtra where('expires_at', '>', now()). Tokens expirados não são reutilizados — nova geração automática."
    },
    {
      "check": "acesso_restrito_painel_lgpd",
      "status": "pass",
      "evidence": "Rota GET /settings/privacy usa middleware [auth, EnsureTwoFactorChallengeCompleted, RequireTwoFactorSession, SetCurrentTenantContext, EnsureReadOnlyTenantMode]. RequireTwoFactorSession verifica auth.two_factor_confirmed na sessão para usuários com two_factor_confirmed_at != null."
    }
  ],
  "next_action": "approved"
}
