{
  "slice_id": "slice-011",
  "verdict": "approved",
  "timestamp": "2026-04-15T21:30:00Z",
  "severity_summary": {
    "critical": 0,
    "high": 0,
    "medium": 0,
    "low": 0,
    "info": 0
  },
  "findings": [],
  "lgpd_checks": [
    {
      "check": "pii_in_logs",
      "status": "pass",
      "evidence": "LogTenantContextOn4xx.sanitizePath() substitui segmentos apos reset-password, invitations, verify e revoke por {REDACTED}. tenant_context loga apenas o ID inteiro do tenant."
    },
    {
      "check": "tenant_data_isolation",
      "status": "pass",
      "evidence": "ScopesToCurrentTenant fail-closed: quando tenant_id e null em contexto web/test, executa whereRaw(1 = 0) retornando conjunto vazio. TenantScopeBypass.run() usado exclusivamente no bootstrap de SetCurrentTenantContext com finally-reset garantido."
    },
    {
      "check": "sensitive_data_encrypted_in_transit",
      "status": "pass",
      "evidence": "Tokens 2FA armazenados criptografados via encrypt()/decrypt() do Laravel. Nenhum dado sensivel trafega em plaintext nos arquivos analisados."
    },
    {
      "check": "data_minimization_in_logs",
      "status": "pass",
      "evidence": "Path sanitizado antes de logar em 4xx (SEC-004 corrigido). Apenas tenant_id (inteiro) e status code sao registrados."
    },
    {
      "check": "base_legal_documented",
      "status": "pass",
      "evidence": "docs/security/lgpd-base-legal.md documenta 9 finalidades com base legal. Logs de auditoria cobertos pela finalidade 9 (Art. 7, VI)."
    },
    {
      "check": "no_pii_hardcoded",
      "status": "pass",
      "evidence": "Nenhum dado pessoal hardcoded nos arquivos analisados."
    }
  ],
  "next_action": "approved"
}