{
  "slice_id": "slice-014",
  "verdict": "approved",
  "timestamp": "2026-04-16T10:00:00Z",
  "severity_summary": {
    "critical": 0,
    "high": 0,
    "medium": 0,
    "low": 0,
    "info": 0
  },
  "findings": [],
  "lgpd_checks": [
    {
      "check": "pii_in_logs",
      "status": "pass",
      "evidence": "ScopesToCurrentTenant loga apenas model e path, sem dados pessoais. ContatoController nao loga PII."
    },
    {
      "check": "pii_fields_identified",
      "status": "pass",
      "evidence": "Campos email e whatsapp identificados como PII (LGPD Art. 5 I). Base legal documentada no Model (Contato.php linhas 22-27): execucao de contrato (LGPD Art. 7 V). Criptografia em repouso documentada como risco aceito MVP (SEC-003 accepted risk, slice-014)."
    },
    {
      "check": "data_minimization",
      "status": "pass",
      "evidence": "Apenas campos necessarios ao negocio sao coletados. whatsapp e email sao opcionais individualmente (ao menos um obrigatorio via validacao)."
    },
    {
      "check": "soft_delete_gdpr_right_erasure",
      "status": "pass",
      "evidence": "SoftDeletes implementado. destroy() usa soft delete preservando auditoria mas permitindo exclusao logica."
    },
    {
      "check": "tenant_isolation",
      "status": "pass",
      "evidence": "Todos os 5 metodos (index, show, store, update, destroy) verificam tenant_id explicitamente via where('tenant_id', $tenant->id) antes de acessar registros. Defense-in-depth alem do global scope ScopesToCurrentTenant."
    }
  ],
  "next_action": "approved"
}
