{
  "slice_id": "slice-009",
  "verdict": "approved",
  "timestamp": "2026-04-14T00:00:00Z",
  "severity_summary": {
    "critical": 0,
    "high": 0,
    "medium": 0,
    "low": 0,
    "info": 0
  },
  "findings": [],
  "lgpd_checks": [
    {
      "check": "pii_in_logs",
      "status": "pass",
      "evidence": "auditRecorder.record grava apenas campos selecionados sem PII: role, company_id, branch_id, requires_2fa, status, accepted_at, feature_code. Nenhum nome, e-mail, token ou senha nos registros de auditoria."
    },
    {
      "check": "invitation_token_storage",
      "status": "pass",
      "evidence": "Token bruto nunca persiste em banco. Armazenado como hash('sha256', $token) em invitation_token_hash. Token apagado (null) apos aceite ou rollback."
    },
    {
      "check": "password_handling",
      "status": "pass",
      "evidence": "Senha gerada aleatoriamente via Hash::make(Str::random(32)) para novos usuarios. Senha do convidado salva via Hash::make. Nenhuma senha em texto plano em log ou auditoria."
    },
    {
      "check": "data_minimization",
      "status": "pass",
      "evidence": "Apenas campos necessarios coletados conforme finalidade 2 (colaborador) e 9 (auditoria) do lgpd-base-legal.md. Sem dado sensivel ou CPF neste slice."
    },
    {
      "check": "cross_tenant_isolation",
      "status": "pass",
      "evidence": "TenantUser e PlanUpgradeRequest usam ScopesToCurrentTenant. assertSameTenant verifica tenant_id em operacoes mutativas. targetTenantUser filtra por tenant_id antes de retornar."
    },
    {
      "check": "access_control_2fa",
      "status": "pass",
      "evidence": "assertActiveManager verifica requires_2fa e two_factor_confirmed_at. UsersPage.mount verifica 2FA antes de renderizar. Papeis gerente e administrativo marcados com requires_2fa=true."
    }
  ],
  "next_action": "approved"
}
