{
  "slice_id": "slice-007",
  "verdict": "approved",
  "timestamp": "2026-04-14T00:38:47-04:00",
  "severity_summary": {
    "critical": 0,
    "high": 0,
    "medium": 0,
    "low": 0,
    "info": 0
  },
  "findings": [],
  "lgpd_checks": [
    {
      "check": "Base legal para auditoria de login",
      "status": "pass",
      "evidence": "lgpd-base-legal.md mapeia auditoria e rastreabilidade como exercicio regular de direito; LoginAuditRecorder persiste evento, user_id, tenant_id, IP e hash de user agent em source/app/Support/Auth/LoginAuditRecorder.php:26-32."
    },
    {
      "check": "Minimizacao e nao persistencia de segredos",
      "status": "pass",
      "evidence": "AuthPayloadSanitizer remove email e redige password, token, code, recovery_code, two_factor_secret e two_factor_recovery_codes em source/app/Support/Auth/AuthPayloadSanitizer.php:15-27; AuthFailureResponse exclui campos sensiveis de old input em source/app/Http/Responses/Auth/AuthFailureResponse.php:30-36."
    },
    {
      "check": "Mensagem neutra em recuperacao de senha",
      "status": "pass",
      "evidence": "POST /auth/forgot-password valida e-mail e sempre retorna PasswordResetLinkSentResponse com mensagem neutra em source/routes/web.php:148-155 e source/app/Http/Responses/Auth/PasswordResetLinkSentResponse.php:13-17."
    },
    {
      "check": "Rate limit de login conforme threat model T-001",
      "status": "pass",
      "evidence": "A rota customizada de login usa 5 tentativas por 900 segundos e lockout temporario apos 10 falhas por e-mail/IP em source/routes/web.php:59-66 e source/routes/web.php:85-86; teste de regressao cobre 15 minutos e 10 falhas em source/tests/slice-007/AuthLoginTest.php:223-248."
    },
    {
      "check": "2FA para papeis criticos e consumo de recovery code",
      "status": "pass",
      "evidence": "TenantAccessResolver exige 2FA para gerente e administrativo em source/app/Support/Auth/TenantAccessResolver.php:16-17 e source/app/Support/Auth/TenantAccessResolver.php:89-94; recovery_code valido e removido apos uso em source/routes/web.php:292-319."
    },
    {
      "check": "Vinculo tenant/usuario e isolamento multi-tenant no escopo do login",
      "status": "pass",
      "evidence": "TenantAccessResolver bloqueia multiplos vinculos ativos, vinculos nao ativos e tenants fora de active/trial/suspended em source/app/Support/Auth/TenantAccessResolver.php:31-87; migrations habilitam FORCE ROW LEVEL SECURITY em tenant_users e login_audit_logs em source/database/migrations/2026_04_13_000120_create_tenant_users_table.php:30-37 e source/database/migrations/2026_04_13_000140_create_login_audit_logs_table.php:30-41."
    },
    {
      "check": "Input validation e escape de output",
      "status": "pass",
      "evidence": "Campos de login, recuperacao, reset e 2FA sao validados em source/routes/web.php:53-57, source/routes/web.php:148-151, source/routes/web.php:166-170 e source/routes/web.php:241-244; feedback Blade usa escape com {{ }} em source/resources/views/livewire/pages/auth/partials/feedback.blade.php:1-20."
    },
    {
      "check": "Secrets no pacote revisado",
      "status": "pass",
      "evidence": "Busca por padroes de segredos em security-review-input retornou apenas nomes de configuracao/uso esperado de token, sem valor secreto materializado."
    }
  ],
  "next_action": "approved"
}
