{
  "slice_id": "slice-005",
  "verdict": "approved",
  "timestamp": "2026-04-13T01:09:03Z",
  "severity_summary": {
    "critical": 0,
    "high": 0,
    "medium": 0,
    "low": 0,
    "info": 0
  },
  "findings": [],
  "lgpd_checks": [
    {
      "check": "pii_in_response",
      "status": "pass",
      "evidence": "Resposta contem apenas status tecnico e timestamp. Detalhes db/redis ficam restritos a IP local para diagnostico controlado. Nenhum dado pessoal retornado."
    },
    {
      "check": "pii_in_logs",
      "status": "pass",
      "evidence": "Controller nao emite logs. Middleware nao loga dados do usuario; usa IP apenas como chave opaca de rate limit."
    },
    {
      "check": "pii_collected",
      "status": "pass",
      "evidence": "Endpoint healthcheck nao coleta, armazena nem processa dados pessoais."
    },
    {
      "check": "rate_limit_store",
      "status": "pass",
      "evidence": "HealthCheckRateLimit usa Cache::store(config('cache.default', 'redis')), sem Cache::store('array') fixo. Em teste, CACHE_STORE=array isola a suite; em producao, .env.example usa CACHE_STORE=redis."
    },
    {
      "check": "security_headers",
      "status": "pass",
      "evidence": "Teste SEC-003 confirma X-Frame-Options DENY, X-Content-Type-Options nosniff, Referrer-Policy e Permissions-Policy na resposta /health."
    },
    {
      "check": "base_legal_documented",
      "status": "not_applicable",
      "evidence": "Nenhum tratamento de dados pessoais neste slice. Base legal nao se aplica."
    }
  ],
  "next_action": "approved"
}
