{
  "slice_id": "slice-008",
  "verdict": "approved",
  "timestamp": "2026-04-14T15:25:43.7717588Z",
  "severity_summary": {
    "critical": 0,
    "high": 0,
    "medium": 0,
    "low": 0,
    "info": 0
  },
  "findings": [],
  "lgpd_checks": [
    {
      "check": "Revalidação de vínculo, papel e status dentro da transação antes de persistir",
      "status": "pass",
      "evidence": "security-review-input/source/app/Support/Tenancy/TenantSettingsUpdater.php"
    },
    {
      "check": "Bloqueio de escrita para tenant em modo somente leitura",
      "status": "pass",
      "evidence": "security-review-input/source/app/Http/Controllers/TenantSettingsController.php"
    },
    {
      "check": "Auditoria sem persistir segredos sensíveis",
      "status": "pass",
      "evidence": "security-review-input/source/app/Support/Tenancy/TenantAuditRecorder.php"
    }
  ],
  "next_action": "approved"
}
