{
  "slice_id": "slice-006",
  "verdict": "approved",
  "timestamp": "2026-04-13T00:40:47.1670195-04:00",
  "severity_summary": {
    "critical": 0,
    "high": 0,
    "medium": 0,
    "low": 0,
    "info": 0
  },
  "findings": [],
  "lgpd_checks": [
    {
      "check": "coleta_de_dados_pessoais",
      "status": "not_applicable",
      "evidence": "Slice 006 entrega apenas rota tecnica /ping fora de production, layout base e componente Livewire com contador inteiro local; nao ha coleta, persistencia ou exibicao de dado pessoal."
    },
    {
      "check": "minimizacao",
      "status": "pass",
      "evidence": "Componente App\\Livewire\\Ping possui somente public int $counter = 0 e renderiza texto tecnico; nao adiciona campos livres, formularios ou identificadores de titular."
    },
    {
      "check": "exposicao_em_producao",
      "status": "pass",
      "evidence": "routes/web.php registra /ping somente quando app()->environment('production') e falso; teste AC-SEC-001 cobre 404 em APP_ENV=production e ausencia de Livewire OK, counter, state e stack."
    },
    {
      "check": "logs_e_rastreabilidade",
      "status": "not_applicable",
      "evidence": "Arquivos do slice nao adicionam chamadas de log nem gravacao de dados pessoais; threat model T-008 permanece sem nova superficie neste slice."
    },
    {
      "check": "segredos",
      "status": "pass",
      "evidence": "mechanical-scan.txt reporta 0 secrets hardcoded e 0 arquivos sensiveis; busca textual no pacote permitido encontrou apenas mencoes documentais a segredo/senha/token."
    }
  ],
  "next_action": "approved"
}
